<?xml version = '1.0'?>
<?xml-stylesheet type="text/xsl" href="../../xslt/atomic-robo_html.xsl"?>
<!DOCTYPE atomic-robo SYSTEM "../../atomic-robo.dtd">
<character>
 <id>
  <charname>Heather Dorsey</charname>
  <playername>Jennifer Cornish</playername>
  <affiliation>Tesladyne's SF office</affiliation>
  <description>
    TBD<!--
         I suggested to Jenn that Heather might've gone to the
         Institute for Social Ecology
    -->
  </description>
 </id>
 <current-fate-points>3</current-fate-points>
 <experience-points>0</experience-points>
 <aspects>
  <aspect type="Concept">"Black Widow for Greenpeace"?</aspect>
  <aspect type="Mode" mode-name="Science">TBD</aspect>
  <aspect type="Mode" mode-name="Intrigue">TBD</aspect>
  <aspect type="Mode" mode-name="Action">TBD</aspect>
  <aspect type="Omega">TBD</aspect>
 </aspects>
 <skills>
  <mode rating="3" name="Science" stress-type="mental">
   <skill name="Notice"/>
   <skill name="Will"/>
   <skill name="(all other Sciences)"/>
  </mode>
  <mode rating="2" name="Intrigue" stress-type="physical">
   <skill name="Athletics"/>
   <skill name="Burglary"/>
   <skill name="Contacts"/>
   <skill name="Deceive"/>
   <skill name="Notice"/>
   <skill name="Stealth"/>
  </mode>
  <mode rating="1" name="Action">
   <skill name="Athletics"/>
   <skill name="Combat"/>
   <skill name="Notice"/>
   <skill name="Physique"/>
   <skill name="Provoke"/>
   <skill name="Vehicles"/>
  </mode>
 </skills>
 <stunts>
 </stunts>
 <consequences>
 </consequences>
 <experiences>
  <experience/>
  <experience/>
  <experience/>
 </experiences>
 <notes>
  Regardless of what modes you have, if they're all standard modes you get ONE of the following improvements:
  * Specialize one trained skill.
  * Focus one trained skill and specialize one focused skill.
  * Focus three trained skills.

  If one of your modes is Science, however, choose ONE improvement from the Everyone list,
  and also apply ALL of the following improvements:
  * Specialize one trained skill.
  * Focus one trained skill.
  * Specialize one focused skill.

  Probably increase Ecology, Biology within Science
 </notes>
</character>
