<?xml version = '1.0'?>
<?xml-stylesheet type="text/xsl" href="../../xslt/atomic-robo_html.xsl"?>
<!DOCTYPE atomic-robo SYSTEM "../../atomic-robo.dtd">
<character>
 <id>
  <charname>Dennis Kim</charname>
  <playername>Supporting NPC</playername>
  <affiliation>Tesladyne SF (Resident Scientist)</affiliation>
  <description>
    22-year old, scruffy, Phish T-shirt, acoustic guitar
    http://bigbangtheory.wikia.com/wiki/Dennis_Kim
  </description>
 </id>
 <current-fate-points>3</current-fate-points>
 <experience-points>0</experience-points>
 <aspects>
  <aspect type="Concept">Brilliant Stoner Resident Scientist</aspect>
  <aspect type="Mode" mode-name="Science">Literally Plays 11-Dimensional Chess</aspect>
  <aspect type="Mode" mode-name="Banter">Abrasive Boy Genius Who Mellowed Out (Mostly)</aspect>
  <aspect type="Mode" mode-name="Intrigue">Smuggled My Grandfather Out of North Korea</aspect>
  <aspect type="Omega">Youngest Recipient of the Stevenson Award</aspect>
 </aspects>
 <skills>
  <mode rating="3" name="Science" stress-type="mental">
   <skill name="Higher-Dimensional Math" add="2"/>
   <skill name="Notice"/>
   <skill name="Pharmacology" add="0"/>
   <skill name="Theoretical Physics" add="2"/>
   <skill name="Will"/>
   <skill name="(all other Sciences)"/>
  </mode>
  <mode rating="2" name="Banter" stress-type="mental">
   <skill name="Contacts"/>
   <skill name="Deceive" add="0"/>
   <skill name="Empathy"/>
   <skill name="Notice"/>
   <skill name="Provoke" add="1"/>
   <skill name="Rapport"/>
   <skill name="Will"/>
  </mode>
  <mode rating="1" name="Intrigue">
   <skill name="Athletics"/>
   <skill name="Burglary" add="0"/>
   <skill name="Contacts"/>
   <skill name="Deceive"/>
   <skill name="Notice"/>
   <skill name="Stealth"/>
  </mode>
 </skills>
 <stunts>
 </stunts>
 <consequences>
 </consequences>
 <experiences>
  <experience/>
  <experience/>
  <experience/>
 </experiences>
 <notes/>
</character>
