<?xml version = '1.0'?>
<?xml-stylesheet type="text/xsl" href="../../xslt/atomic-robo_html.xsl"?>
<!DOCTYPE atomic-robo SYSTEM "../AtomicRobo/atomic-robo.dtd">
<character>
 <id>
  <charname>Karen Alazar</charname>
  <playername>Supporting NPC</playername>
  <affiliation>Tesladyne SF (Action Scientist)</affiliation>
  <description>
    A stocky woman born in Los Angeles to Eritrean immigrant parents.
    Went to Cal for Engineering, currently lives in Oakland.
    Could easily pass for a Forgotten Realms Gold Dwarf, both in appearance and culture.
  </description>
 </id>
 <current-fate-points>3</current-fate-points>
 <experience-points>0</experience-points>
 <aspects>
  <aspect type="Concept">TBD</aspect>
  <aspect type="Mode" mode-name="Science">So Many Gadgets</aspect>
  <aspect type="Mode" mode-name="Soldier">USAF Veteran of Afghanistan and Iraq</aspect>
  <aspect type="Mode" mode-name="Action">"...and MY AXE."</aspect>
  <aspect type="Omega">TBD</aspect>
 </aspects>
 <skills>
  <mode rating="3" name="Science" stress-type="mental"> <!-- ARRPG pg85 -->
   <skill name="Civil Engineering"      add="1"/> <!-- Focus 1 Trained from Science Mode -->
   <skill name="Communications Systems" add="2"/> <!-- Spec 1 Trained from Science Mode -->
   <skill name="Notice"/>
   <skill name="Will"/>
   <skill name="(all other Sciences)"/>
  </mode>
  <mode rating="2" name="Soldier" stress-type="physical"> <!-- ARRPG pg91 -->
   <skill name="Athletics"/>
   <skill name="Combat"/>
   <skill name="Contacts"/>
   <skill name="Notice"/>
   <skill name="Physique"/>
   <skill name="Tactics"/>
   <skill name="Vehicles" add="1"/> <!-- Spec 1 Focused from Science Mode -->
   <skill name="Will"/>
  </mode>
  <mode rating="1" name="Action"> <!-- ARRPG pg82 -->
   <skill name="Athletics"/>
   <skill name="Combat"/>
   <skill name="Notice"/>
   <skill name="Physique"/>
   <skill name="Provoke"/>
   <skill name="Vehicles"/>
  </mode>
 </skills>
 <stunts>
  <stunt name=" ">TBD</stunt>
  <stunt name=" ">TBD</stunt>
  <stunt name=" ">TBD</stunt>
  <stunt name=" ">TBD</stunt>
  <stunt name=" ">TBD</stunt>
 </stunts>
 <consequences>
 </consequences>
 <experiences>
  <experience/>
  <experience/>
  <experience/>
 </experiences>
 <notes>
  http://en.wikipedia.org/wiki/Habesha_name
  http://en.wikipedia.org/wiki/Category:Eritrean_culture
 </notes>
</character>
