<?xml version = '1.0'?>
<?xml-stylesheet type="text/xsl" href="../../xslt/atomic-robo_html.xsl"?>
<!DOCTYPE atomic-robo SYSTEM "atomic-robo.dtd">
<character>
 <id>
  <charname>Nikola Tesla</charname>
  <playername>sample Atomic Robo character</playername>
  <affiliation>Westinghouse Electric</affiliation>
 </id>
 <current-fate-points>2</current-fate-points>
 <experience-points>0</experience-points>
 <aspects>
  <aspect type="Concept">Eccentric Inventor of Beautiful Apparatuses</aspect>
  <aspect type="Mode" mode-name="Science">Master of Lightning*</aspect>
  <aspect type="Mode" mode-name="Banter">Magnetic Charm</aspect>
  <aspect type="Mode" mode-name="Action"/>
  <aspect type="Omega">My Method Is Different</aspect>
 </aspects>
 <skills>
  <mode rating="3" name="Science" stress-type="mental">
   <skill name="Electrical Engineering" add="2"/>
   <skill name="Mechanical Engineering" add="2"/>
   <skill name="Physics" add="2"/>
   <skill name="Will"    add="1"/>
   <skill name="Notice"  add="1"/>
   <skill name="(All other Sciences)"/>
  </mode>
  <mode rating="2" name="Banter" stress-type="mental">
   <skill name="Contacts" add="1"/>
   <skill name="Deceit"/>
   <skill name="Empathy"/>
   <skill name="Provoke"  add="1"/>
   <skill name="Rapport"/>
   <skill name="Will"/>
  </mode>
  <mode rating="1" name="Action">
   <skill name="Athletics" add="2"/>
   <skill name="Combat"    add="1"/>
   <skill name="Physique"/>
   <skill name="Vehicles"/>
  </mode>
 </skills>
 <stunts>
  <stunt name="Signature Aspect">
    Master of Lightning (invoke once for free, compel at two fate points instead of one)
  </stunt>
 </stunts>
 <consequences>
  <consequence severity="Mild">mild one</consequence>
 </consequences>
 <experiences>
  <experience>experience1: this is longer than the others</experience>
  <experience>experience2</experience>
  <experience used="true">experience3</experience>
 </experiences>
</character>
