<?xml version = '1.0'?>
<?xml-stylesheet type="text/xsl" href="../xslt/atomic-robo_html.xsl"?>
<!DOCTYPE atomic-robo SYSTEM "../atomic-robo.dtd">
<character>
 <id>
  <charname>Nikola Tesla</charname>
  <playername>sample Atomic Robo character</playername>
  <affiliation>Westinghouse Electric</affiliation>
 </id>
 <refresh>2</refresh>
 <current-fate-points>2</current-fate-points>
 <aspects>
  <aspect type="concept">Eccentric Inventor of Beautiful Apparatuses</aspect>
  <aspect type="science_mode">Master of Lightning*</aspect>
  <aspect type="banter_mode">Magnetic Charm</aspect>
  <aspect type="action_mode"/>
  <aspect type="omega">My Method Is Different</aspect>
 </aspects>
 <skills>
  <mode rating="3" name="Science">
   <skill name="Electrical Engineering" add="2"/>
   <skill name="Mechanical Engineering" add="2"/>
   <skill name="Physics" add="2"/>
   <skill name="Will"    add="1"/>
   <skill name="Notice"  add="1"/>
   <skill name="(All other Sciences)"/>
  </mode>
  <mode rating="2" name="Banter">
   <skill name="Contacts" add="1"/>
   <skill name="Deceit"/>
   <skill name="Empathy"/>
   <skill name="Provoke"  add="1"/>
   <skill name="Rapport"/>
   <skill name="Will"/>
  </mode>
  <mode rating="1" name="Action">
   <skill name="Athletics" add="2"/>
   <skill name="Combat"    add="1"/>
   <skill name="Physique"/>
   <skill name="Vehicles"/>
  </mode>
 </skills>
 <stunts>
  <stunt name="Signature Aspect">
    Master of Lightning (invoke once for free, compel at two fate points instead of one)
  </stunt>
 </stunts>
 <hacks skill-modes="true"/>
 <consequences>
  <consequence severity="mild">mild one</consequence>
 </consequences>
</character>
