<?xml version = '1.0'?>
<?xml-stylesheet type="text/xsl" href="../../xslt/atomic-robo_html.xsl"?>
<!DOCTYPE atomic-robo SYSTEM "../AtomicRobo/atomic-robo.dtd">
<character>
 <id>
  <charname>Frank Rogers</charname>
  <playername>Michael Wood</playername>
  <affiliation>Tesladyne SF (Action Scientist PC)</affiliation>
  <description>
    TBD
  </description>
 </id>
 <current-fate-points>3</current-fate-points>
 <experience-points>0</experience-points>
 <aspects>
  <aspect type="Concept">TBD</aspect>
  <aspect type="Mode" mode-name="Telepath">TBD</aspect>
  <aspect type="Mode" mode-name="Martial Artist">TBD</aspect>
  <aspect type="Mode" mode-name="Action">The Batman of Human Resources</aspect>
  <aspect type="Omega">TBD</aspect>
 </aspects>
 <skills>
  <mode rating="3" name="Telepath" stress-type="mental"> <!-- ARRPG pg92 -->
   <skill name="Deceive"/>
   <skill name="Empathy"/>
   <!-- OR Focus 1 Trained Skill instead of Hallucinations -->
   <skill name="Hallucinations"/>
   <skill name="Provoke"/>
   <skill name="Rapport"/>
   <skill name="Will"/>
  </mode>
  <mode rating="2" name="Martial Artist" stress-type="physical"> <!-- ARRPG pg88 -->
   <skill name="Athletics"/>
   <skill name="Combat"/>
   <skill name="Notice"/>
   <skill name="Physique"/>
   <skill name="Stealth"/>
   <skill name="Will"/>
  </mode>
  <mode rating="1" name="Action">
   <skill name="Athletics"/>
   <skill name="Combat"/>
   <skill name="Notice"/>
   <skill name="Physique"/>
   <skill name="Provoke"/>
   <skill name="Vehicles"/>
  </mode>
 </skills>
 <stunts>
  <stunt name=" ">TBD</stunt>
  <stunt name=" ">TBD</stunt>
  <stunt name=" ">TBD</stunt>
  <stunt name=" ">TBD</stunt>
  <stunt name=" ">TBD</stunt>
 </stunts>
 <consequences>
 </consequences>
 <experiences>
  <experience/>
  <experience/>
  <experience/>
 </experiences>
 <notes/>
</character>
